judul,isi,tanggal,kategori
"Dorong Pengembangan SDM, Jawa Satu Power Bangun Gedung Sekolah di Karawang","KOMPAS.com – Pertamina New & Renewable Energy (Pertamina NRE) melalui salah satu afiliasinya, PT Jawa Satu Power (JSP), berkomitmen mendukung pengembangan pendidikan dengan membangun gedung sekolah untuk Sekolah Dasar Negara (SDN) Cilamaya 7 di Desa Cilamaya, Kecamatan Cilamaya Wetan, Kabupaten Karawang, Jawa Barat. Pembangunan fasilitas pendidikan tersebut meliputi lima ruang kelas baru dan tiga ruang kelas hasil renovasi yang telah selesai pada Selasa (19/11/2024). Chief Executive Officer (CEO) JSP Putri Dwi Kusumawati menekankan pentingnya peran sektor usaha dalam mendukung sektor pendidikan. “Pendidikan adalah fondasi utama untuk mencetak generasi muda yang unggul, siap menghadapi tantangan global,” ujarnya dalam siaran pers yang diterima Kompas.com, Rabu (20/11/2024). Baca juga: Manuver PLN Hadapi Tantangan Global lewat Penyediaan Energi Ramah Lingkungan JSP meyakini bahwa pendidikan yang berkualitas merupakan investasi jangka panjang bagi masyarakat dan bangsa. Dengan pembangunan gedung sekolah tersebut, JSP berharap dapat menyediakan fasilitas belajar yang layak, nyaman, dan memotivasi bagi para siswa-siswi SDN Cilamaya 7. “Kami ingin menumbuhkan semangat belajar mereka, agar kelak menjadi individu-individu yang dapat berkontribusi pada pembangunan daerah dan nasional,” tutur Dwi. Sejak Maret 2024, pembangkit listrik tenaga gas uap (PLTGU) Jawa-1 yang dimiliki oleh JSP telah beroperasi dengan kapasitas 1.765 Megawatt (MW), yang mampu menyuplai listrik untuk wilayah Jawa-Madura-Bali. Baca juga: Berikan Dampak ke Masyarakat, 53 UMKM Akan Hadir di Pertamina Eco RunFest 2024 Pada kesempatan yang sama, Corporate Secretary Pertamina NRE Dicky Septriadi menambahkan bahwa keberlanjutan dan manfaat bagi masyarakat merupakan fokus utama dalam setiap kegiatan yang dilaksanakan oleh perusahaan. “Kami berusaha memastikan bahwa setiap aktivitas kami, baik operasional maupun non-operasional, memberikan manfaat yang signifikan bagi masyarakat sekitar, baik dalam aspek ekonomi, pendidikan, maupun lingkungan,” ucapnya. Senada dengan Dicky, Vice President (VP) Corporate Communication PT Pertamina (Persero) Fadjar Djoko Santoso menjelaskan bahwa Pertamina mendukung pencapaian Tujuan Pembangunan Berkelanjutan (SDGs), khususnya tujuan ke-4, yaitu Pendidikan Berkualitas dan tujuan ke-8 tentang Pekerjaan Layak serta Pertumbuhan Ekonomi. “Melalui pembangunan sarana dan prasarana pendidikan, kami berharap kualitas pendidikan dapat meningkat, mendorong daya saing masyarakat, dan membantu peningkatan perekonomian,” imbuhnya. Sementara itu, Penjabat (Pj) Bupati Karawang Teppy Wawan Dharmawan mengapresiasi JSP atas kontribusinya dalam dunia pendidikan di Karawang. “Sinergi antara dunia usaha dan pemerintah sangat penting untuk mempercepat pembangunan sumber daya manusia di daerah,” katanya. Baca juga: Pertamina Bakal Pasarkan Bioavtur dari Jelantah pada 2025 Masyarakat sekitar yang diwakili oleh Ketua Komite SDN Cilamaya 7 Dede Koswara, juga mengucapkan rasa terima kasih dan kebanggaan atas bantuan tersebut. “Kami sangat bersyukur dan merasa terharu memiliki gedung sekolah baru. Fasilitas ini tidak hanya memberikan kenyamanan, tetapi juga memotivasi anak-anak kami untuk meraih prestasi lebih tinggi,” ucap Dede. Sebagai bagian dari sub holding Pertamina NRE, JSP tidak hanya mendukung proses transisi energi yang telah ditetapkan, tetapi juga berkomitmen untuk memastikan keberlanjutan aktivitasnya guna mencapai Net Zero Emission (NZE) pada 2060. Komitmen tersebut bertujuan tidak hanya untuk menciptakan lingkungan yang lebih baik, tetapi juga untuk mencetak sumber daya manusia yang unggul dan berkualitas. ","Kompas.com - 20/11/2024, 20:33 WIB",Nasional
Ridwan Kamil Janji Selesaikan Masalah IMB Rumah Ibadah di 100 Hari Pertama Menjabat,"JAKARTA, KOMPAS.com - Calon gubernur Jakarta nomor 1, Ridwan Kamil berjanji akan menyelesaikan masalah perizinan rumah ibadah yang tidak kunjung terbit dalam 100 hari pertamanya jika terpilih menjadi gubernur periode 2024-2029. Kepada sejumlah tokoh politik, rohaniawan, dan umat Katolik yang hadir, Ridwan Kamil berjanji untuk memudahkan pemberian izin membangun rumah ibadah. “Perizinan rumah ibadah seluas-luasnya, termasuk ada yang (rumah ibadahnya sudah berdiri, (surat) IMB-nya belum itu (terbit). Mungkin 100 hari pertama bisa kita perizinkan (selesaikan),” ujar Ridwan Kamil dalam acara diskusi dan silaturahmi dengan komunitas Katolik dan Kristiani di sebuah hotel di Tanah Abang, Jakarta Pusat pada Rabu (20/11/2024). Baca juga: Ridwan Kamil Ajak Jokowi Hadiri Kampanye Akbar di Jakarta, Undangan Sudah Disampaikan Mantan gubernur Jawa Barat ini juga berjanji akan menambah kuota guru agama di sejumlah sekolah. Saat ini, guru agama Katolik dan Kristen dinilai masih jauh dari memadai. “Kedua, kebutuhan guru agama di sekolah-sekolah rasionya masih kurang. Itu saya kira bisa diwujudkan dengan mudah,” imbuh dia. Ridwan Kamil berjanji untuk menghadirkan bantuan operasional rumah ibadah yang proporsional. Termasuk juga untuk program kunjungan ke Tanah Suci, misalnya ke Vatikan atau Yerusalem. Baca juga: APK-nya Banyak Dirusak dan Dicoret, Ridwan Kamil: Itu Mah dari Dulu Dalam diskusi ini, dia juga memamerkannya rekam jejaknya sebagai pemimpin yang berkeadilan dan merangkul keberagaman. “Waktu saya wali kota Bandung, saya dengan PKS, ketua tim sukses saya orang Katolik, namanya Alosius Ipong Witono,” kata dia. Ridwan Kamil menyinggung soal kinerjanya yang pernah membuat 31 pemimpin kelompok radikal bertobat ketika menjabat sebagai gubernur Jawa Barat. “Saya komit menjaga NKRI, menjaga Pancasila, merangkul semua golongan agama, memberantas radikalisme. Sudah saya tunjukkan kan, saya menginsafkan 31 pemimpin radikal saat jadi gubernur Jawa Barat,” kata dia. Baca juga: Ridwan Kamil Janji Bantu PPP Raih Kejayaannya Lagi di Jakarta ","Kompas.com - 20/11/2024, 20:28 WIB",Megapolitan
"DPR Selesaikan Uji Kelayakan 7 Calon Dewas KPK Hari Ini, 3 Lainnya Besok","JAKARTA, KOMPAS.com - Komisi III DPR RI telah menyelesaikan uji kelayakan dan kepatutan (fit and proper test) terhadap tujuh dari sepuluh calon anggota Dewan Pengawas (Dewas) Komisi Pemberantasan Korupsi (KPK) pada Rabu (20/11/2024). Ketua Komisi III DPR RI Habiburokhman menyampaikan, dengan demikian, fit and proper test untuk tiga calon Dewas KPK lainnya akan dilanjutkan pada Kamis (21/11/2024). ""Terima kasih rekan-rekan, kita lanjutkan besok pagi jam 08.00 WIB ya. Jadi nanti setelahnya bisa pulang kampung ke Pilkada masing-masing nih. Kita tunda sampai besok pagi jam 08.00 WIB,"" ujar Habiburokhman di ruang rapat Komisi III DPR RI. Baca juga: Chisca Mirawati Soroti Konflik Capim dan Dewas KPK Saat Uji Kelayakan di DPR Tujuh calon Dewas KPK yang telah menjalani uji kelayakan dan kepatutan adalah Mirwazi, Elly Fariani, Wisnu Baroto, Benny Mamoto, Gusrizal, Sumpeno, dan Chisca Mirawati. Sementara itu, tiga calon lainnya yang akan diuji pada Kamis adalah Iskandar, Heru Kreshna Reza, dan Hamdi. Sebelumnya, Wakil Ketua Komisi III DPR RI Ahmad Sahroni mengungkapkan bahwa hasil dari uji kelayakan dan kepatutan calon pimpinan serta anggota Dewas KPK akan diumumkan pada Kamis. Baca juga: Gusrizal Singgung Dewas KPK Ibarat Macan Ompong, Perlu Revisi UU KPK DPR RI telah menggelar uji kelayakan dan kepatutan atau fit and proper test untuk calon pimpinan KPK dan calon anggota Dewas KPK sejak Senin lalu. Sebanyak sepuluh orang calon pimpinan KPK dan sepuluh orang calon anggota Dewas KPK mengikuti proses ini. DPR akan memilih lima orang pimpinan KPK dan lima orang anggota Dewas KPK yang akan menjabat selama lima tahun ke depan. ","Kompas.com - 20/11/2024, 20:23 WIB",Nasional
Chisca Mirawati Soroti Konflik Capim dan Dewas KPK Saat Uji Kelayakan di DPR,"JAKARTA, KOMPAS.com - Calon anggota Dewan Pengawas (Dewas) Komisi Pemberantasan Korupsi (KPK) Chisca Mirawati mengungkapkan keprihatinannya terhadap konflik yang sering terjadi antara pimpinan dan Dewas di lembaga anti rasuah tersebut. Dalam sesi uji kelayakan dan kepatutan (fit and proper test) di Komisi III DPR RI pada Rabu (20/11/2024) malam, Chisca menegaskan bahwa masalah ini seharusnya tidak terjadi di lembaga yang seharusnya menjaga kepercayaan publik. “Kalau saya ikuti semua, kita semua juga sudah tahu timbulnya pertentangan antara pimpinan dan Dewas dengan egonya masing-masing. Kita semua juga sangat menyesalkan,” kata Chisca. Baca juga: Sumpeno Usul Dewas KPK Bisa Pantau Pimpinan KPK Lewat Kamera CCTV Chisca menilai bahwa pertentangan antara pimpinan dan Dewas menjadi salah satu faktor yang menyebabkan menurunnya tingkat kepercayaan masyarakat terhadap KPK. “Saya melihat bagaimana publik pada umumnya. Kenapa kok bisa sampai terjadi pertentangan seperti itu? Di suatu lembaga yang harusnya bisa menjaga kepercayaan publik. Sangat menyedihkan,” ujarnya. Untuk mengatasi masalah ini, Chisca menekankan pentingnya perbaikan pola komunikasi antara pimpinan dan Dewas KPK. Ia berkomitmen untuk mendorong perbaikan tersebut jika terpilih sebagai anggota Dewas KPK. Chisca yakin bahwa KPK ke depan masih bisa menjadi lebih baik, berkat adanya kesamaan visi dan misi dari calon pimpinan dan Dewas saat ini. “Tentunya saya percaya, semuanya bahkan mungkin Capim yang dalam proses ini mempunyai tujuan yang sama. Itu suatu awal yang baik mempunyai tujuan yang sama, komitmen yang kuat untuk bisa memperbaiki kondisi ini, untuk mengembalikan kepercayaan publik kepada KPK,” ungkap Chisca. Baca juga: Ketua Komisi III Minta Pimpinan dan Dewas KPK Tiadakan Doorstop, Benny Mamoto Setuju “Saya percaya itu, dan saya yakin bisa berjalan. Asalkan kembali kepada niatnya, niat baik. Seberapa bagus pun peraturan, metodologi, kerangka hukum, jika tidak ada niat baik akan sulit menurut saya kembali ke basic,” ujarnya. Sebagai informasi, DPR RI sedang melaksanakan uji kelayakan dan kepatutan atau fit and proper test untuk calon pimpinan KPK dan calon anggota Dewas KPK selama empat hari, mulai Senin (18/11/2024) hingga Kamis (21/11/2024). Sebanyak 10 orang calon pimpinan KPK dan 10 orang calon anggota Dewas KPK berpartisipasi dalam uji kelayakan ini. DPR akan memilih lima orang pimpinan KPK dan lima orang anggota Dewas KPK yang akan menjabat selama lima tahun ke depan. ","Kompas.com - 20/11/2024, 20:18 WIB",Nasional
Menteri Hukum Lobi DPR dan Ketum Parpol untuk Muluskan RUU Perampasan Aset,"JAKARTA, KOMPAS.com - Menteri Hukum Supratman Andi Agtas mengaku tengah melakukan lobi ke DPR RI dan ketua umum partai politik agar pembahasan Rancangan Undang-Undang (RUU) Perampasan Aset bisa dilakukan.  Lobi-lobi itu dilakukan karena RUU Perampasan Aset tidak masuk dalam program legislasi nasional (prolegnas) prioritas 2025, hanya masuk prolegnas 2025-2029. ""Sekarang kami lagi melakukan upaya dialog bersama dengan parlemen, dengan ketua-ketua umum partai politik,” kata Supratman di Kantor Kementerian Hukum, Jakarta, Rabu (20/11/2024). Baca juga: Baleg Ungkap Alasan RUU Perampasan Aset Tak Masuk Prolegnas Prioritas 2025 Supratman berharap, lobi tersebut dapat memuluskan pembahasan RUU Perampasan Aset bila Presiden Prabowo Subianto bersurat ke DPR untuk menuntaskan RUU tersebut. Ia mengeklaim, Prabowo punya keinginan kuat untuk melakukan pemberantasan korupsi sehingga lobi-lobi terus dilakukan “Supaya begitu Presiden Prabowo akan mengirim surpres untuk masuk di dalam prolegnas yang akan datang, memastikan bahwa itu akan dijamin untuk dibahas dan dilakukan pembahasan di parlemen,” kata Supratman. Baca juga: Capim KPK Johanis Tanak: Diksi “Perampasan” pada RUU Perampasan Aset Kurang Pas Politikus Partai Gerindra ini mengakui bahwa RUU Perampasan Aset belum sepenuhnya diterima oleh anggota DPR. Misalnya, ada usul agar nomenklatur RUU Perampasan Aset diubah menjadi RUU Pemulihan Aset. ""Kemudian juga beberapa materi muatan yang ada di dalam itu masih resisten. Nah karena itu sekali lagi, bahwa lebih bagus kami clearkan dulu pembicaraan informal itu, melakukan lobi-lobi, baru kemudian kita lakukan upaya itu,” ujar Supratman. ","Kompas.com - 20/11/2024, 20:17 WIB",Nasional
"Dana Pinjaman Dibawa Kabur, Anak Usaha KoinWorks Rugi Rp 365 Miliar"," JAKARTA, KOMPAS.com - Anak usaha KoinWorks, KoinP2P, merugi Rp 365 miliar usai dana pinjamannya diduga dibawa kabur oleh seseorang berinisial MT. “Korban merasa dirugikan Rp 365 miliar,” ungkap Kabid Humas Polda Metro Jaya Kombes Pol Ade Ary Syam Indradi di Polda Metro Jaya, Rabu (20/11/2024). Peristiwa bermula saat pelapor berinisial BAA selaku direktur dari PT Lunaria Annua Teknologi menjalin kerja sama dengan MT pada 2021. Baca juga: Polisi Usut Kasus Pinjaman Anak Usaha KoinWorks yang Dibawa Kabur “Kerja sama di bidang peer to peer lending atau peminjam. Terlapor ini sebagai penjamin perorangan dan perusahaan,” ujar Ade Ary. Berdasarkan laporan itu, setidaknya ada dua skema dugaan penipuan. Pertama, MT mengajukan pinjaman dengan melampirkan 279 data pribadi atau kartu tanda penduduk (KTP). “Sehingga, akhirnya korban memberikan dana Rp 330 miliar. Itu skema yang pertama,” ujar Ade Ary. Sementara, skema kedua, BAA mengajukan pinjaman bilateral sebanyak Rp 35 miliar. “Atas dua skema itu, terlapor diduga tidak melakukan pembayaran kepada korban,” pungkas Ade Ary. Diberitakan sebelumnya, sejumlah nasabah atau lender KoinWorks mengeluhkan dana investasi yang gagal dibayarkan kembali oleh platform fintech peer to peer lending itu. Anak perusahaan Koinworks, KoinP2P mengakui, saat ini perusahaan menghadapi permasalahan dana pinjaman yang tidak dibayarkan oleh debitur inisial M, berasal dari perusahaan berinisial MPP. Baca juga: Bocah di Tangerang Disetrum karena Dituduh Mencuri Uang Rp 700.000 Direktur KoinP2P Jonathan Bryan menjelaskan, MPP adalah perusahaan distributor kelas kakap yang sudah beroperasi sejak 2000 dengan jaringan distribusi hampir di seluruh Indonesia. MPP mendistribusikan barang dari pabrikan ke distributor kecil (UMKM), kemudian UMKM mendistribusikan ke toko-toko kelontong. Adapun KoinP2P merupakan fintech P2P lending yang memberikan pinjaman ke bisnis di bawah ekosistem supply chain MPP. ""Semua berjalan baik dan bisnis model ini sudah teruji. Semua menjadi rusak ketika pemilik MPP berbuat jahat dengan membawa kabur dana pemilik UMKM yang seharusnya dibayarkan ke para lender,"" tutur Jonathan, dalam keterangannya, Selasa (19/11/2024). Baca juga: Koboi Jalanan yang Umbar Tembakan di Depok Ditahan di Polsek Cinere ","Kompas.com - 20/11/2024, 20:16 WIB",Megapolitan
Pemerintah Kaji Pemulangan Narapidana WNA ke Negara Asal Selain Mary Jane,"JAKARTA, KOMPAS.com - Menteri Hukum Supratman Andi Agtas mengungkapkan bahwa pemerintah Indonesia sedang mengkaji pemulangan sejumlah narapidana warga negara asing (WNA) ke negara asal mereka, termasuk WN Filipina Mary Jane yang merupakan terpidana mati atas kasus narkoba. Dalam konferensi pers di Kantor Kementerian Hukum, Rasuna Said, Kuningan, Jakarta Selatan, pada Rabu (20/11/2024), Supratman menyampaikan bahwa pihaknya tengah berkoordinasi dengan beberapa menteri terkait, termasuk Menteri Koordinator Bidang Hukum, HAM, Imigrasi, dan Pemasyarakatan Yusril Ihza Mahendra, serta Menteri Imigrasi dan Pemasyarakatan Komjen Pol Agus Andrianto. “Karena bukan hanya Mary, ada juga narapidana dari Perancis dan beberapa dari Inggris,” kata Supratman. Baca juga: Kata Dirjen Pemasyarakatan soal Mary Jane Disebut Bakal Dipulangkan ke Filipina Ia menambahkan, para duta besar dari negara-negara tersebut telah mengajukan surat permohonan kepada Presiden Prabowo Subianto untuk memindahkan narapidana tersebut ke negara masing-masing. Supratman menekankan, Indonesia terbuka terhadap permintaan dari negara-negara tersebut, dengan syarat bahwa mereka mengakui sistem hukum yang berlaku di Indonesia. “Tetapi sementara kami pelajari bersama Pak Menko, Prof Yusril, nanti pada akhirnya kami komunikasikan dan konsultasikan kepada Presiden sebelum keputusan itu diambil, mana yang terbaik,” tuturnya. Baca juga: Setuju Pulangkan Terpidana Mati Mary Jane ke Filipina, Apa Untungnya Buat Indonesia? Selain itu, Supratman juga menyebutkan bahwa pemerintah berupaya untuk mengembalikan narapidana warga negara Indonesia (WNI) yang saat ini menjalani hukuman di luar negeri. Salah satu langkah yang telah diambil adalah berkomunikasi dengan Duta Besar Australia. “Kami juga meminta agar warga negara Indonesia yang ada di luar negeri sedapat mungkin bisa dipulangkan jika terjadi pertukaran,” imbuhnya. Baca juga: Mary Jane Diharap Tak Dipulangkan ke Filipina sebagai Terpidana Mati Sebelumnya, Yusril Ihza Mahendra mengonfirmasi bahwa pemerintah Indonesia telah sepakat dengan pemerintah Filipina untuk memulangkan Mary Jane, terpidana mati dalam kasus penyelundupan narkotika. Namun demikian, ia menegaskan bahwa pemerintah Indonesia tidak membebaskan Mary, melainkan memulangkannya melalui kebijakan pemindahan narapidana atau transfer of prisoner. ","Kompas.com - 20/11/2024, 20:14 WIB",Nasional
Bocah di Tangerang Disetrum karena Dituduh Mencuri Uang Rp 700.000,"TANGERANG, KOMPAS.com - Seorang bocah berinisial MR (10) diduga dirundungdi Desa Muncung, Kecamatan Kronjo, Kabupaten Tangerang karena dituduh mencuri uang Rp 700.000. Kapolresta Tangerang Kombes Pol Baktiar Joko Mujiono mengatakan, polisi telah menangkap empat pelaku. ""Pelaku sudah kita tangkap. Ada empat orang, laki-laki semua,"" ujar Baktiar saat dikonfirmasi, Rabu (20/11/2024). Baca juga: Cerita Ibu dari Tangerang Batal Lapor Mas Wapres lantaran Kuota Terbatas Korban sempat mengalami tindakan kekerasan, mulai dari disetrum, dibanting, hingga disiram dengan minuman keras oleh pelaku. Akibatnya, korban mengalami trauma dan harus mendapatkan pendampingan dari pihak Polresta Tangerang. ""Kondisi korban sekarang trauma. Kami memberikan pendampingan bersama stakeholder terkait untuk memulihkan kondisi korban,"" kata dia. Baca juga: Digerebek Warga, Ruko di Ciputat Diduga Jadi Sarang Prostitusi Online Baktiar mengatakan, saat ini polisi masih menyelidiki kebenaran terkait korban yang dituding mencuri oleh para pelaku. Polisi juga memastikan pelaku akan diproses hukum sesuai aturan yang berlaku. ""Untuk dugaan awal seperti itu (pencurian), nanti kami dalami lebih lanjut,"" ucap dia. Baca juga: Sabu Asal Afghanistan Dijual Murah, Menjadi Daya Tarik Bandar Lokal ","Kompas.com - 20/11/2024, 20:11 WIB",Megapolitan
"Rapat Komisi IV DPR, Menteri Kehutanan Didesak Cabut IPPKH Tambang Nakal","JAKARTA, KOMPAS.com - Menteri Kehutanan Raja Juli Antoni didesak untuk mencabut Izin Pinjam Pakai Kawasan Hutan (IPPKH) perusahaan tambang nakal yang merusak lingkungan. Desakan ini diampaikan anggota Komisi IV DPR RI dari Fraksi Partai Nasdem Rajiv dalam Rapat Kerja dengan Menteri Kehutanan di Kompleks Parlemen, Jakarta, Rabu (20/11/2024). ""Saya mau tanya komitmen Pak Menteri Kehutanan berani tidak mencabut IPPKH perusahaan tambang yang tidak menjalankan reboisasi yang sudah diperintahkan kementerian kehutanan,” tanya Rajiv ke Raja Juli. Menurut Rajiv, masih ada perusahaan tambang yang nakal dan enggan melakukan rehabilitasi lahan terutama di wilayah daerah aliran sungai (DAS). Baca juga: Dampingi Hashim, Menhut Raja Juli Jadi Wakil Ketua Delegasi di COP29 Lebih lanjut, ia mendesak Kementerian Kehutanan harus berani mencabut IPPKH perusahaan tambang yang beroperasi di daerah tambang yang tidak melakukan rehabilitasi lahan. “Masih ada perusahaan yang ogah-ogahan melaksanakan kewajibannya melakukan reforestrasi atau rehabilitasi lahan yang telah rusak akibat kegiatan usaha mereka,” ungkap Rajiv. Merespons desakan ini, Menteri Kehutanan Raja Juli Antoni menyatakan tak segan mencabut IPPKH milik perusahaan nakal yang enggan menjalankan tanggung jawab penghijauan lahan setelah digunakan. “Secara tegas saya katakan saya berani, saya enggak ada masalah,” jawab Raja Juli dalam rapat. Baca juga: Menhut Raja Juli dan Jaksa Agung Bahas Strategi Menjerat Perusak Hutan Dia menyatakan, selama ada data yang tersedia dan terbukti ada perusahaan tak bertanggung, hal ini akan ditindaklanjuti Kementerian Kehutanan. Kementerian Kehutanan juga akan menggandeng otoritas penegak hukum seperti Kepolisian dan Kejaksaan. “Selama datanya ada, dengan otoritas yang kita miliki, dengan kerja sama dengan kepolisian dan kejaksaan, kita akan tindak secara tegas IPPKH yang nakal ini, nggak ada soal saya,” kata Raja Juli. ","Kompas.com - 20/11/2024, 20:04 WIB",Nasional
"Sabu Asal Afghanistan Dijual Murah, Menjadi Daya Tarik Bandar Lokal","JAKARTA, KOMPAS.com - Dirresnarkoba Polda Metro Jaya Kombes Pol Donald Parlaungan Simanjuntak mengungkapkan, narkotika jenis sabu asal Afghanistan kerap diminati bandar narkoba karena harga jualnya yang terbilang murah. Hal ini terungkap setelah pemeriksaan terhadap dua tersangka berinisial MS (30) dan CP (34), yang baru saja ditangkap pada Minggu (17/11/2024). ""Kita tahu bersama bahwa di sana ada daerah konflik, dan harga sabu di Afghanistan ini sangat murah. Kalau dibandingkan dengan di Jakarta, ini salah satu yang memotivasinya,"" kata Donald di Polda Metro Jaya, Rabu (20/11/2024). Baca juga: 389 Kilogram Sabu Disita dari Dua Kurir Narkoba Jaringan Afganistan-Jakarta Di Afghanistan, sabu dijual seharga Rp 75 juta per kilogram. Sementara, di Indonesia, harga sabu bisa mencapai Rp 1,5 miliar hingga Rp 2 miliar per kilogram. “Ini salah satu yang membuat mereka itu menjadi daya tariknya,” tambah Donald. Sebelumnya, MS dan CP ditangkap oleh Ditresnarkoba Polda Metro Jaya karena terlibat dalam peredaran narkotika jenis sabu. Mereka ditangkap di wilayah Cengkareng, Jakarta Barat, pada Minggu (17/11/2024). Baca juga: Pasokan Sabu dari Afganistan Masuk lewat Jalur Laut ke Jakarta Polisi berhasil menyita barang bukti sabu seberat 389 kilogram yang berasal dari Afghanistan. Sabu tersebut dikemas dalam 315 bungkus plastik bening. Pengiriman dilakukan dengan jalur laut dari Afghanistan ke Aceh, kemudian diteruskan ke Jakarta melalui jalur darat melalui Pelabuhan Bakauheni. Akibat perbuatannya, kedua pelaku disangkakan Pasal 114 ayat 2 subsider Pasal 112 ayat 2 UU RI Nomor 35 Tahun 2009 tentang Narkotika, dengan ancaman pidana maksimal penjara seumur hidup atau hukuman mati. ","Kompas.com - 20/11/2024, 20:04 WIB",Megapolitan
"Bertemu Ketum Jakmania, Suswono Janjikan JIS Jadi ""Homebase"" Persija","JAKARTA, KOMPAS.com - Calon wakil gubernur Jakarta nomor urut 1, Suswono bertemu dengan Ketua Umum Jakmania, Diky Soemarno, dalam pembahasan Sepakbola Bahasa PerSATUan, Rabu (20/11/2024). Dalam diskusi ini, Diky bertanya terkait bentuk kolaborasi yang akan dilakukan apabila Suswono dan Ridwan Kamil terpilih di Pilkada Jakarta 2024. ""Tentu kami juga ada komitmen bagaimana supaya JIS (Jakarta International Stadium) yang sudah dibangun dengan biaya cukup besar ini bisa dipakai optimal sehingga bisa menjadi home base-nya Persija,"" ujar Suswono di Bendungan Hilir, Jakarta Pusat, Rabu. Baca juga: Ridwan Kamil Sebut Suswono Tak Ikut Temui Jokowi karena Sibuk Blusukan Dengan berbagai dukungan dari partai Koalisi Indonesia Maju (KIM) Plus dan DPRD, Suswono berharap Persija bisa mendapatkan kemudahan mengakses JIS pada masa kepemimpinannya. ""Tentu untuk Jakmania sendiri juga ada kemudahan untuk bisa menghasilkan JIS ya, apakah nanti dalam bentuk transportasi yang gratis dan sebagainya,"" tuturnya. Suswono juga bakal mengusahakan memperbanyak dana CSR maupun sponsor dari berbagai pihak untuk memberikan kemudahan bagi Persija. ""Di samping tentu dukungan secara resmi dari APBD, itu satu hal yang sudah pasti kami akan dukung, sehingga Persija akan kembali menjadi kebanggan untuk warga Jakarta,"" kata dia. Menanggapi itu, Diky mengatakan, saat ini Jakmania membutuhkan satu program konkret terkait penggunaan JIS untuk pertandingan Persija. Baca juga: Gibran Instruksikan Relawan Menangkan Ridwan Kamil-Suswono di Pilkada Jakarta ""Sebenarnya yang kami butuhkan adalah program konkret, paslon Kang Emil dan Pak Sus tinggal memberikan apa program konkretnya, JIS dipastikan tidak boleh digunakan untuk konser, kalau bisa itu,"" kata dia. Mendengar permintaan tersebut, Suswono menegaskan, nantinya akan mengawasi penggunaan JIS untuk konser. ""Menurut persepsi teman-teman dari Persija kan ada interval, misalnya apakah 3 bulan sekali atau 6 bulan sekali, yang penting, tidak menganggu agendanya Persija. Ini yang kami bakal jamin,"" ucapnya. Baca juga: Kompaknya Suswono, Kun Wardana, dan Rano Karno: Tak Mau Ada Penggusuran dalam Konflik Agraria ","Kompas.com - 20/11/2024, 20:00 WIB",Megapolitan
