judul,isi,tanggal,kategori
"Rakornas Dukcapil, Wamendagri: Enggak Mungkin Kita Jadi 5 Besar Ekonomi 2045 Tanpa Data","JAKARTA, KOMPAS.com - Wakil Menteri Dalam Negeri (Wamendagri) RI, Bima Arya menekankan pentingnya data untuk mencapai cita-cita menjadi lima besar ekonomi dunia di tahun 2045. Hal itu disampaikan Bima dalam Rapat Koordinasi Nasional (Rakornas) Direktorat Jenderal Kependudukan dan Pencatatan Sipil (Ditjen Dukcapil), di Grand Mercure, Jakarta Pusat, Kamis (21/11/2024). ""Enggak mungkin kita berperang tanpa data, enggak mungkin kita menyasar ekonomi Indonesia menjadi satu dari lima besar dunia di tahun 2045 tanpa data, ini fase krusial kritikal,"" ujarnya. Data dukcapil inilah, kata Bima, menjadi dasar agar mimpi-mimpi besar Presiden Prabowo Subianto bisa menjadi kenyataan. Baca juga: Inovasi Mobil Keliling Dukcapil Surakarta Tuai Pujian dari Wamendagri Bima Arya Mantan Walikota Bogor ini mengatakan, Prabowo sering menyampaikan di berbagai kesempatan agar ekonomi Indonesia bisa tumbuh dengan baik. ""Presiden Prabowo itu secara lantang menyampaikan dalam berbagai kesempatan. 8 percent of economic growth, GDP 10.000 USD, one of the five largest economy in the world,"" ucap dia. Bima mengatakan, data yang ada di Ditjen Dukcapil adalah kunci untuk menyusun beragam program, termasuk program untuk Rancangan Pembangunan Jangka Menengah Nasional (RPJMN). Perencanaan pembangunan harus membutuhkan data yang valid sehingga bisa berjalan dengan baik. Sebab itu, Ditjen Dukcapil adalah lembaga yang penting untuk menentukan beragam kebijakan yang bisa diambil dan tepat sasaran. Baca juga: Mendagri Bagi Tugas Dua Wamennya, Bima Arya Diminta Jadi Jubir ""Kita mungkin tidak bisa membayangkan betapa strategisnya kita semua ini. Insan yang sekarang menekuni kolaborasi dan sinergi di bidang kependudukan dan catatan sipil untuk bisa mendukung capai-capai nasionalitas,"" tandasnya. ","Kompas.com - 21/11/2024, 10:56 WIB",Nasional
"""Endorsement"" Prabowo dan Jokowi Vs Anies dan Ahok di Pilkada Jakarta, Siapa Paling Berpengaruh?","JAKARTA, KOMPAS.com - Dukungan dari elite politik, seperti presiden, mantan presiden, dan mantan gubernur dinilai mampu memengaruhi elektabilitas pasangan calon (paslon) gubernur dan wakil gubernur Pilkada Jakarta 2024. Pengamat politik dari UIN Jakarta, Ahmad Bakir Ihsan menilai, pemilih Jakarta punya ciri khas tersendiri. Meski Jakarta menjadi pusat pemerintahan negara, warganya dinilai lebih melekat dengan sosok gubernur mereka. “Kalau bicara efektif tidaknya dukungan, yang pertama terkait dengan momentum, di mana ini Pilkada Jakarta, tentu masyarakatnya ini yang paling lekat dalam ingatannya adalah pada sosok yang pernah memimpin di Jakarta,” ujar Ahmad saat dihubungi Kompas.com,Rabu (20/11/2024). Sosok Presiden ke-7 RI Joko Widodo misalnya. Meski pernah menjadi gubernur Jakarta pada 2012-2014,pengaruhnya pada Pilkada Jakarta 2024 dinilai tidak terlalu signifikan karena masa kepemimpinannya singkat. “Walaupun Jokowi pernah memimpin di Jakarta, tapi waktunya sangat singkat,” ujar Ahmad.   Hal ini, menurut Ahmad, terlihat dari besarnya animo warga yang meminta Ahok untuk kembali memegang jabatan publik. “Ahok saya kira dalam kontestasi Pilkada DKI juga mendapat dukungan yang banyak dan sampai sekarang juga punya, boleh dibilang, basis massa yang ada,” kata Ahmad. Pun demikian dengan Gubernur Jakarta periode 2017-2022 Anies Baswedan. Anies dinilai punya basis massa besar. Selain karena pernah berkontestasi di Pemilu Presiden (Pilpres) 2024, Anies juga sempat digadang-gadang kembali berlaga di Pilkada Jakarta 2024. “Anies saya kira juga punya kekuatan yang luar biasa pada pilpres kemarin, di Pilkada DKI juga signifikan,” tutur Ahmad. Dengan tidak berkontestasinya Anies pada pilkada kali ini, kata Ahmad, arah dukungan mantan Menteri Pendidikan dan Kebudayaan tersebut ditunggu-tunggu pendukung setianya. “Karena itu, dukungan Ahok dan Anies untuk Pramono Anung menurut saya lebih signifikan ya pengaruhnya terhadap elektabilitas Pramono dan Rano Karno dibandingkan dukungan Jokowi dan Prabowo untuk Ridwan Kamil dan Suswono,” imbuh Ahmad. Ahmad menilai, dukungan Ahok dan Anies untuk Pramono Anung-Rano Karno bisa mendorong elektabilitaspaslon nomor urut 3 itu. Terlebih, elektabilitas Pram-Rano menurut survei sejumlah lembaga mulai mengejar, bahkan unggul tipis dari paslon nomor urut 1 Ridwan Kamil-Suswono yang diusung oleh Koalisi Indonesia Maju (KIM) Plus. ","Kompas.com - 21/11/2024, 10:38 WIB",Megapolitan
"Calon Pimpinan dan Dewas KPK Ingin Hapus OTT, Pukat UGM: Untuk Ambil Hati Anggota DPR","JAKARTA, KOMPAS.com - Peneliti Pusat Kajian Antikorupsi Universitas Gadjah Mada Zaenur Rohman menilai, pernyataan calon pimpinan dan anggota dewan pengawas KPK yang hendak meniadakan Operasi Tangkap Tangan (OTT) merupakan sesat pikir. Menurut Zaenur, gagasan tersebut disampaikan hanya untuk menyenangkan anggota Komisi III DPR yang tengah menguji mereka.  ""Saya lihat ini adalah sesat pikir, sekadar ingin mengambil hati dan menyenangkan anggota DPR. Anggota DPR itu paling takut sama OTT,"" kata Zaenur saat dihubungi, Kamis (21/11/2024).  Baca juga: Johanis Tanak Ingin Tiadakan OTT KPK, Komisi III DPR Tepuk Tangan  Zaenur mengatakan, istilah Operasi Tangkap Tangan (OTT) memang tidak ada dalam Kitab Undang-Undang Hukum Acara Pidana (KUHAP). Namun, OTT itu adalah istilah populer.  Ia mengatakan, dalam KUHAP disebutkan bahwa tangkap tangan adalah penangkapan yang dilakukan setelah terjadinya tindak pidana korupsi.  ""KPK melakukan persiapan, mengumpulkan informasi, menyiapkan tim, kemudian melakukan pengamatan. Kalau memang terjadi transaksi kemudian dilakukan tangkap tangan. Jadi operasi itu istilah populer, bukan istilah hukum,"" ujarnya.  Baca juga: Pimpinan KPK Sebut OTT Tak Mungkin Dihilangkan  Sebelumnya, salah satu calon pimpinan KPK Johanis Tanak mengaku ingin meniadakan operasi tangkap tangan (OTT) seandainya terpilih sebagai ketua KPK. Hal itu ia sampaikan dalam sesi tanya jawab pada uji kelayakan dan kepatutan calon pimpinan KPK di Komisi III DPR RI, Selasa (19/11/2024). ""Seandainya saya bisa jadi, mohon izin, jadi ketua, saya akan tutup, close, karena itu (OTT) tidak sesuai dengan pengertian yang dimaksud dalam KUHAP,"" kata dia di hadapan anggota Dewan. Pernyataan calon pimpinan KPK petahana itu langsung disambut dengan riuh tepuk tangan para anggota Komisi III seisi ruangan.  Baca juga: Seleksi Calon Dewas KPK, Anggota DPR Sebut Tukang Becak Pun Bisa OTT Salah satu alon anggota Dewas KPK yakni Wisnu Baroto, mengaku berpikiran sama dengan Johanis Tanak tentang tidak perlunya lagi OTT KPK. Namun, ia tidak melihatnya dari sisi legalitas.  Menurut dia, OTT yang selama ini dilakukan KPK tak lagi relevan dengan pemberantasan korupsi. Penyidik KPK, menurut dia, harus mampu menganalisis dan mendeteksi kasus korupsi yang besar dan melibatkan organ strategis bangsa.  ""Dengan berkembangnya modus kejahatan yang canggih, beragam, dan berskala besar, maka metode OTT tidak lagi mumpuni untuk memerangi hal tersebut,” tutur Staf Ahli Jaksa Agung Muda Bidang Tindak Pidana Umum dikutip dari Kompas.id. Sebagai informasi, DPR RI sedang melaksanakan uji kelayakan dan kepatutan atau fit and proper test untuk calon pimpinan KPK dan calon anggota Dewas KPK selama empat hari, mulai Senin (18/11/2024) hingga Kamis (21/11/2024). Sebanyak 10 orang calon pimpinan KPK dan 10 orang calon anggota Dewas KPK berpartisipasi dalam uji kelayakan ini. DPR akan memilih lima orang pimpinan KPK dan lima orang anggota Dewas KPK yang akan menjabat selama lima tahun ke depan. ","Kompas.com - 21/11/2024, 10:35 WIB",Nasional
"Tingkatkan Daya Saing Tenaga Kerja Papua, Menaker Dorong Pelatihan Vokasi Berbasis Potensi Lokal","KOMPAS.com - Menteri Ketenagakerjaan (Menaker) Yassierli menekankan pentingnya pelatihan vokasi yang disesuaikan dengan potensi dan kebutuhan lokal Papua untuk meningkatkan daya saing tenaga kerja di daerah tersebut. Saat ini, kata dia, berbagai jenis pelatihan vokasi telah dilaksanakan di Balai Latihan Kerja (BLK) Unit Pelaksanaan Teknis Pusat (UPTP), Unit Pelaksanaan Teknis Daerah (UPTD), serta BLK Komunitas di Papua. Yassierli mengungkapkan komitmennya untuk memperkuat kerja sama dengan pemerintah daerah (pemda), lembaga pendidikan, dan sektor swasta guna memastikan pelatihan yang diberikan relevan dan efektif. Baca juga: Kuasa Hukum Nilai Laporan terhadap Said Didu Tidak Relevan dan Langgar HAM “Melalui kerja sama ini, saya yakin Papua dapat menjadi pusat pertumbuhan ekonomi berbasis keterampilan. Seperti yang selalu disampaikan oleh Presiden Republik Indonesia (RI) Prabowo Subianto, penting untuk terus menciptakan inovasi dan lapangan pekerjaan baru di setiap daerah,” ujarnya dalam siaran pers yang diterima Kompas.com, Kamis (21/11/2024). Pernyataan tersebut disampaikan oleh Yassierli saat menerima audiensi dari Majelis Rakyat Papua (MRP), di Kantor Kementerian Ketenagakerjaan (Kemnaker) Jakarta, Rabu (20/11/2024). Audiensi tersebut membahas strategi optimalisasi BLK Papua untuk meningkatkan kualitas pelatihan vokasi di daerah tersebut. Baca juga: Indonesia-Jerman Kerja Sama Pendidikan dan Pelatihan Vokasi Industri Pada kesempatan itu, Yassierli menjelaskan bahwa tujuan dari audiensi tersebut adalah untuk memperkuat sinergi antara pemerintah pusat dan daerah dalam mendukung pengembangan sumber daya manusia (SDM) di Papua melalui pelatihan vokasi. “Dukungan untuk transformasi BLK di Papua sangat penting agar menjadi lebih inklusif, modern, dan relevan dengan kebutuhan pasar. Kolaborasi dengan Majelis Rakyat Papua akan memastikan keberhasilan pelatihan vokasi berbasis kebutuhan lokal,” imbuhnya. ","Kompas.com - 21/11/2024, 10:24 WIB",Nasional
"Seleksi Calon Dewas KPK, Hamdi Sebut Kasus Firli Bahuri Tak Bisa Dimaafkan","JAKARTA, KOMPAS.com - Calon Dewan Pengawas (Dewas) KPK Hamdi Hassyarbain menilai kasus etik dan pidana yang menyeret Eks Ketua KPK Firli Bahuri tidak bisa dimaafkan.  Hamdi menyatakan ini dalam uji kelayakaan dan kepatutan (fit and proper test) Calon Dewas KPK di Komisi III DPR RI, Jakarta, Kamis (21/11/2024).  ""Jadi saya kira itu pelanggaran etika yang menurut saya tidak bisa dimaafkan,"" kata Hamdi.  Baca juga: Kasus Firli Bahuri Gantung Hampir Setahun, Kapolda: Tenang Saja, Nanti Selesai  Dia mengatakan banyak kasus baik etik maupun pidana yang menyeret Firli Bahuri.  Menurut Hamdi, hal ini sudah menjadi pelanggaran etik yang berat.  Sebab, sebagai Ketua KPK, Firli seharusnya menegakkan integritas dan memberantas korupsi  ""Kasus helikopter, kemudian upaya pemerasan terhadap mantan Mentan SYL,"" ucap Hamdi.  ""Jadi saya kira itu pelanggaran etika yang sangat berat karena Anda seharusnya menegakkan integritas harus memberantas korupsi tapi Anda berkolaborasi dengan tersangka,"" imbuhnya. Baca juga: Gusrizal Singgung Dewas KPK Ibarat Macan Ompong, Perlu Revisi UU KPK  Untuk diketahui, Firli ditetapkan sebagai tersangka kasus pemerasan eks Menteri Pertanian (Mentan) Syahrul Yasin Limpo (SYL) pada 22 November 2023.  Syahrul diduga diperas menyangkut penanganan perkara dugaan korupsi di Kementerian Pertanian.  Firli dijerat Pasal 12 huruf e atau Pasal 12 huruf B, atau Pasal 11 Undang-Undang Nomor 31 Tahun 1999 sebagaimana telah diubah dengan Undang-Undang Nomor 20 Tahun 2001 tentang perubahan atas Undang-Undang Nomor 39 Tahun 1999 tentang Pemberantasan Tindak Pidana Korupsi jo Pasal 65 KUHP dengan ancaman hukuman penjara seumur hidup.  Dalam kasus ini, Firli telah menjalani beberapa pemeriksaan sebagai tersangka. Namun, ia tidak ditahan. ","Kompas.com - 21/11/2024, 10:21 WIB",Nasional
Sejarah Hari Perhubungan Darat Nasional Setiap Tanggal 22 November,"KOMPAS.com – Tanggal 22 November 2024 terdapat peringatan Hari Perhubungan Darat Nasional. Hari Perhubungan Darat Nasional diperingati setahun sekali dan merupakan bagian dari refleksi kehadiran transportasi darat di Indonesia. Hari Perhubungan Darat Nasional berbeda dengan Hari Perhubungan Nasional yang diperingati setiap tanggal 17 September. Hari Perhubungan Darat Nasional diinisiasi oleh Kementerian Perhubungan RI pada tahun 1971. Tujuannya untukmembangun transportasi lintas darat menjadi transportasi yang memiliki akses utama bagi masyarakat. Sejak Indonesia merdeka, jalur darat masih menjadi transportasi jalur utama yang dipilih banyak orang.  Moda transportasi di darat sangat banyak mulai dari kereta, bus, angkutan umum dan lain sebagainya. Tidak hanya itu saja bahkan pejalan kaki juga dianggap berperan dalam memajukan sektor darat. Dengan adanya hari ini diharapkan bisa mendorong orang untuk terus menggunakan transportasi umum darat yang kini semakin modern. Jauh sebelum Indonesia merdeka, masyarakat Indonesia menggunakan transportasi darat memanfaatkan tenaga manusia dan hewan seperti kuda, pedati, gerobak, andong serta becak sebagai angkutan pribadi. Perkembangan transportasi di Indonesia kemudian semakin modern sejak era kemerdekaan yang didominasi oleh angkutan darat seperti bus, angkot hingga kereta api. Namun begitu patut diketahui bahwa Belanda, Inggris, dan Jepang juga berperan dalam mengembangkan transportasi darat modern kala itu di Indonesia. Seperti jalur Pantai Utara (Pantura), juga disebut sebagai jalur Daendles, yang membentang sepanjang 1.000 km dari Anyer (Banten) hingga Panarukan (Jawa Timur). Kini alat transportasi darat di Indonesia mendominasi dibanding alat transportasi laut dan udara. Itulah yang membuat pemerintah semakin giat memajukan transportasi darat sebagai angkutan umum untuk khalayak luas. Referensi: Hakim, Lukmanul. (2024). Manajemen Transportasi dan Pariwisata. Yogyakarta: Deepublish ","Kompas.com - 21/11/2024, 10:02 WIB",Nasional
"Bawa Anak Saat Pimpin Rapat di DPR, Rahayu Saraswati: Sebisa Mungkin Habiskan Waktu Bareng","JAKARTA, KOMPAS.com - Wakil KetuaKomisi VIIDPR Rahayu Saraswati memangku anaknya ketika memimpin rapat dengan Menteri Pariwisata di Kompleks Parlemen, Jakarta, Rabu (20/11/2024) kemarin.  Wanita yang akrab disapa Sara ini mengaku bukan pertama kalinya membawa anak ketiganya saat bekerja di DPR RI.  ""Ini kedua kalinya. Bisa dilihat di Instagram beberapa minggu lalu juga saya bawa (anak),"" kata Sara saat dihubungi Kompas.com, Kamis (21/11/2024).  Baca juga: Rahayu Saraswati: Parpol Kurang Caleg Perempuan Harus Mundur dari Pemilu, Bukan Akali Aturan  Dia mengaku sebisa mungkin ingin menghabiskan waktu bersama anaknya. Selain itu, anak ketiganya juga tidak sekolah di hari Rabu dan cukup nyaman berada di keramaian.  ""Karena kesibukan saya, sebisa mungkin saya bisa spend time (habiskan waktu) dengan dia. Kebetulan dia suka ikut mamanya berkegiatan dan lumayan nyaman saja di keramaian,"" ungkap Sara. Menurut Wakil Ketua Umum Partai Gerindra itu, anak pertamanya juga pernah dibawa ke tempat kerjanya.  ""Anak pertama juga pernah saya bawa-bawa waktu saya masih menyusui,"" ucap ponakan Presiden Prabowo Subianto ini. Sebuah kiriman dibagikan oleh Kompas.com (@kompascom)  Lebih lanjut, Sara menilai sangat penting bagi anak untuk mengetahui kegiatannya sebagai seorang perempuan yang berkiprah di dunia politik.  Dia berharap dirinya bisa menjadi contoh baik bagi anak perempuannya.  ""Agar anak laki-laki kita tahu bahwa perempuan bisa dan anak perempuan kita juga dapat contoh yang baik. Walking the talk istilahnya,"" ucapnya.  Adapun dalam rapat kemarin, terlihat Sara memangku anak perempuannya yang masih berusia balita.  Saat Sara bertepuk tangan dalam rapat, tampaknya putrinya itu juga ikut bertepuk dan tertawa. ","Kompas.com - 21/11/2024, 09:57 WIB",Nasional
"Oleng dan Terjatuh, Pengendara Motor Tewas Terlindas Truk di Jalan Raya Narogong","BEKASI, KOMPAS.com - GS (44), seorang pengendara motor, tewas terlindas truk usai oleng dan terjatuh di Jalan Raya Narogong Km 6, Bojong Rawa Lumbu, Rawa Lumbu, Kota Bekasi, Rabu (20/11/2024). Akibat insiden ini, korban pun meninggal di tempat kejadian perkara (TKP). ""Pengendara sepeda motor GS meninggal dunia di TKP,"" ujar Kepala Unit Penegakan Hukum Satuan Lalu Lintas Polres Metro Bekasi Kota Iptu Suwandi dalam keterangannya, Kamis (21/11/2024). Suwandi menjelaskan, insiden kecelakaan berawal ketika sepeda motor Honda Vario yang ditunggangi korban melaju dari arah Cileungsi, Kabupaten Bogor, menuju Kota Bekasi. Baca juga: Potret Hamparan Sampah Liar Seluas Lapangan Bola di Babelan, Akankah Menteri LH Turun Tangan? Sesampainya di Jalan Raya Narogong Km 6, sepeda motor yang dikendarai korban tiba-tiba oleng. Selanjutnya, korban pun terjatuh ke aspal Jalan Raya Narogong Km 6. Di saat yang bersamaan, datang sebuah truk Hino yang dikemudikan AH (29). Truk tersebut kemudian melindas korban. Korban pun tewas seketika di TKP. Baca juga: Jangan Ada Lagi Polisi yang Tolak Laporan Warga... ""Kemudian terlindas ban depan sebelah kiri kendaraan truk dan terjadilah kecelakaan tersebut,"" kata Suwandi. Tak lama, petugas tiba di lokasi dan langsung membawa jasad korban ke RSUD dr.Chasbullah Abdulmadjid Kota Bekasi. ","Kompas.com - 21/11/2024, 09:51 WIB",Megapolitan
"Sumbangan Dana Kampanye Dharma-Kun Rp 180,7 Juta, Sudah Terpakai Rp 119,8 Juta","JAKARTA, KOMPAS.com - Hingga 21 November 2024, total laporan penerimaan sumbangan dana kampanye (LPSDK) pasangan calon gubernur dan wakil gubernur Jakarta nomor urut 2, Dharma Pongrekun-Kun Wardana sebesar Rp 180 juta. Dari jumlah tersebut, mayoritas berupa sumbangan uang. Angkanya sebesar Rp95.901.207,71. Dikutip dari laman Komisi Pemilihan Umum (KPU), sebagian sebesar uang sumbangan dana kampanye itu berasal dari Dharma-Kun pribadi, yakni Rp 65 juta. Sementara, uang sumbangan pihak lain perseorangan sebanyak Rp 30.900.000. Dharma-Kun juga menerima sumbangan dana kampanye dalam bentuk barang dari pihak lain perseorangan, jumlahnya Rp 84.400.000.   Dalam laporan disebutkan, sumbangan dana kampanye baik yang berbentuk uang maupun barang sudah digunakan sebesar Rp 119.817.148,54 Sehingga, saat ini, saldo penerimaan sumbangan dana kampanye pasangan calon independen tersebut berjumlah Rp60.924.059,17. Adapun dana kampanye awal Dharma-Kun hanya Rp 5.000.000. Seperti diketahui, ada tiga calon gubernur dan wakil gubernur yang akan berkompetisi pada Pilkada Jakarta 2024. Ketiganya yakni, pasangan nomor urut 1 yang diusung Koalisi Indonesia Maju (KIM) Ridwan Kamil-Suswono. Nomor urut 2, calon independen Dharma Pongrekun-Kun Wardana. Sementara, nomor urut 3 ada pasangan calon yang diusung PDI Perjuangan, Pramono Anung dan Rano Karno. Adapun masa kampanye Pilkada 2024 resmi dimulai pada 25 September 2024. Kampanye akan berlangsung hingga 23 November 2024. Sementara, hari pemungutan suara akan digelar serentak di seluruh Indonesia pada 27 November 2024. Baca juga: Dharma-Kun Tetapkan Menggelar Kampanye Akbar di Kalideres Usai Tak Dapat Izin di Waduk Pluit ","Kompas.com - 21/11/2024, 09:36 WIB",Megapolitan
"Judi ""Online"" Ancam Ekonomi, Potensi Perputaran Uang Capai Rp 700 T","JAKARTA, KOMPAS.com – Pemerintah memperkirakan potensi perputaran uang dari transaksi judi daring (online) bisa mencapai Rp 700 triliun jika langkah intervensi tidak dilakukan. “Data dari PPATK (Pusat Pelaporan dan Analisis Transaksi Keuangan) menunjukkan perputaran uang judi online hampir Rp 400 triliun. Tanpa upaya pencegahan, perputarannya bisa mencapai Rp 700 triliun,” kata Wakil Menteri Komunikasi dan Digital (Komdigi) Nezar Patria, dalam Pelantikan Pengurus Asosiasi Media Siber Indonesia (AMSI) Jawa Timur Periode 2024-2028 di Surabaya, Rabu (20/11/2024), seperti dikutip dari Antara. Pemerintah, kata Nezar, terus bergerak memblokir akun-akun judi online yang bermunculan setiap hari. Sosialisasi tentang bahaya judi online juga digencarkan untuk meningkatkan literasi masyarakat. “Kita terus meningkatkan literasi anti judi online di masyarakat,” ucap Nezar. Baca juga: TNI Perkuat Satuan Siber Cegah Prajurit Judi Online Langkah ini bertujuan agar masyarakat memahami risiko bermain judi online dan tidak lagi tergoda. Upaya pemberantasan membutuhkan kolaborasi lintas lembaga, termasuk pemerintah daerah. Nezar menegaskan pentingnya kerja sama erat agar pemberantasan lebih menyeluruh dan efektif. “Pemberantasan lebih menyeluruh membutuhkan kolaborasi semua lembaga,” ujar Nezar. Baca juga: Polisi Bakal Lacak Aset Tersangka Judi Online yang Libatkan Pegawai Komdigi Pemerintah daerah juga diharapkan terlibat aktif dalam sosialisasi bahaya judi online, mengingat dampaknya tidak hanya merugikan individu tetapi juga masyarakat secara keseluruhan. ","Kompas.com - 21/11/2024, 09:29 WIB",Nasional
Terdakwa Kasus Timah Keberatan Asetnya Disita Kejagung untuk Tutup Kerugian Negara Rp 332 T,"  JAKARTA, KOMPAS.com - Kuasa hukum terdakwa kasus korupsi timah Robert Indarto, Handika Honggowongso, memprotes Kejaksaan Agung yang hendak menyita aset para terdakwa untuk menutupi kerugian negara. Ia meminta Kejagung melakukan pembebanan uang pengganti dan eksekusi penyitaan aset sesuai aturan yang berlaku. Hal itu disampaikan Handika merespons pernyataan Direktur Penyidikan Jampidsus Kejagung Abdul Qohar, yang menyebut seluruh aset tersangka akan disita untuk menutupi kerugian negara Rp 332,6 Triliun.  “Jadi jelas tidak bisa jumlah kerugian negara dalam dakwaan sebesar Rp 300 triliun di bebankan semua pada terdakwa,” ungkap Handika di Jakarta, Rabu (20/11/24).  Baca juga: Kejagung Akan Sita Aset Para Tersangka Kasus Timah, Tutupi Kerugian Negara Rp 332 Triliun  Handika mengatakan, penyitaan aset tidak bisa dilakukan atas dasar pengembalian kerugian negara.  Sebab, jumlah uang pengganti yang bisa di bebankan kepada terdakwa dibatasi, yaitu sebanyak-banyaknya sama dengan hasil kekayaan yang didapat dari hasil tindak pidana korupsi.  “Dengan demikian, mohon kepada Kejagung dalam pembebanan uang pengganti betul-betul menaati pasal 18 ayat 1 huruf b UU Tipikor, tidak melampauii batas limitatifnya,” ucap Handika.  Baca juga: Mengapa Kerugian Negara dalam Korupsi Timah Naik Usai Hendry Lie Ditangkap?  Lebih lanjut Handika menjelaskan bahwa, PT Timah sejak 2015-2022 memberikan kompensasi Rp 26 triliun atas biaya penambangan biji timah sebanyak 154.000 ton kepada para mitra tambang, termasuk masyarakat.   Sehingga, terdakwa Robert Indarto selaku Direktur PT Sariwiguna Binasentosa (SBS) yang terseret kasus ini tidak menikmatinya. Jumlah kompensasi itu juga masih jauh dari kerusakan lingkungan yang diperkirakan sebesar Rp 271 triliun.  Menurut Handika, PT Timah sudah meng-coverkerusakan lingkungan itu dengan program dan jaminan reklamasi untuk memulihkannya. ""Negara pun sebenarnya sudah untung, buktinya ada pembayaran royalti dan pajak, baik dari PT Timah ataupun 5 smelter yang jumlah totalnya sekitar Rp 2 triliunan,"" tambah dia.  “Namun demikian, apa yang disampaikan oleh pihak Kejagung itu terkait pembebanan Rp 332 triliun, itu bisa saja di lakukan apabila Kejaksaan menempuh upaya gugatan perdata, bukan pakai jalur pidana tipikor,” tegas dia. Baca juga: Sidang Kasus Timah, Hakim Singgung Putusan MK Nyatakan Kekayaan BUMN Masuk Keuangan Negara Kejagung sebelumnya menyatakan, akan menyita seluruh aset para tersangka korupsi kasus tata niaga komoditas timah. Dirdik Jampidsus Kejagung Abdul Qohar mengatakan, penyitaan ini perlu dilakukan untuk menutupi kerugian negara dari kasus korupsi timah yang nilainya mencapai Rp 332,6 triliun. “Kerugian negara kan Rp 332,6 triliun, itu nanti akan dikenakan uang pengganti,” jelas Abdul Qohar di Kejagung, Selasa dini hari (19/11/2024). Dia menjelaskan bahwa kerugian tersebut akan dikonversi dengan nilai aset para tersangka korupsi dan TPPU. “Kerugian ini dikonversi atau diperhitungkan dengan aset para tersangka yang sudah dilakukan penyitaan,” jelasnya. “Nanti akan dibebankan ke masing - masing tersangka. Aset yang telah disita apabila telah memiliki kekuatan hukum tetap akan dilakukan pelelangan untuk menutupi uang pengganti masing - masing tersangka, dan besarnya sesuai putusan pengadilan,” tegas dia.  ","Kompas.com - 21/11/2024, 09:25 WIB",Nasional
